{
  "kind": "forge",
  "version": 1,
  "id": "gitlab",
  "name": "GitLab",
  "badge": "GL",
  "executables": [
    "glab"
  ],
  "remote": {
    "hosts": [
      "gitlab.com"
    ],
    "namespace": "nested",
    "case": "exact"
  },
  "auth": {
    "argv": [
      "auth",
      "status",
      "--hostname",
      {
        "parts": [
          {
            "slot": "host",
            "encoding": "literal"
          }
        ]
      }
    ],
    "successExitCodes": [
      0
    ]
  },
  "environment": {
    "GITLAB_PAGER": "cat"
  },
  "minimumIntervalSeconds": 60,
  "operations": {
    "lookupByBranch": {
      "open": {
        "argv": [
          "api",
          {
            "parts": [
              "projects/",
              {
                "slot": "project",
                "encoding": "percent-component"
              },
              "/merge_requests"
            ]
          },
          "--hostname",
          {
            "parts": [
              {
                "slot": "host",
                "encoding": "literal"
              }
            ]
          },
          "--method",
          "GET",
          "--raw-field",
          "scope=all",
          "--raw-field",
          "state=opened",
          "--raw-field",
          {
            "parts": [
              "source_branch=",
              {
                "slot": "branch",
                "encoding": "literal"
              }
            ]
          },
          "--raw-field",
          "per_page=2",
          "--raw-field",
          "page=1"
        ],
        "jsonExitCodes": [
          0
        ]
      },
      "all": {
        "argv": [
          "api",
          {
            "parts": [
              "projects/",
              {
                "slot": "project",
                "encoding": "percent-component"
              },
              "/merge_requests"
            ]
          },
          "--hostname",
          {
            "parts": [
              {
                "slot": "host",
                "encoding": "literal"
              }
            ]
          },
          "--method",
          "GET",
          "--raw-field",
          "scope=all",
          "--raw-field",
          "state=all",
          "--raw-field",
          {
            "parts": [
              "source_branch=",
              {
                "slot": "branch",
                "encoding": "literal"
              }
            ]
          },
          "--raw-field",
          "per_page=2",
          "--raw-field",
          "page=1"
        ],
        "jsonExitCodes": [
          0
        ]
      }
    },
    "resolveNumber": {
      "argv": [
        "api",
        {
          "parts": [
            "projects/",
            {
              "slot": "project",
              "encoding": "percent-component"
            },
            "/merge_requests/",
            {
              "slot": "number",
              "encoding": "literal"
            }
          ]
        },
        "--hostname",
        {
          "parts": [
            {
              "slot": "host",
              "encoding": "literal"
            }
          ]
        },
        "--method",
        "GET"
      ],
      "jsonExitCodes": [
        0
      ]
    },
    "refresh": {
      "argv": [
        "api",
        {
          "parts": [
            "projects/",
            {
              "slot": "project",
              "encoding": "percent-component"
            },
            "/merge_requests/",
            {
              "slot": "number",
              "encoding": "literal"
            }
          ]
        },
        "--hostname",
        {
          "parts": [
            {
              "slot": "host",
              "encoding": "literal"
            }
          ]
        },
        "--method",
        "GET"
      ],
      "jsonExitCodes": [
        0
      ]
    }
  },
  "mapping": {
    "number": [
      "iid"
    ],
    "branch": [
      "source_branch"
    ],
    "headSha": [
      "sha"
    ],
    "state": [
      "state"
    ],
    "states": {
      "opened": "OPEN",
      "closed": "CLOSED",
      "merged": "MERGED"
    },
    "title": [
      "title"
    ],
    "webUrl": [
      "web_url"
    ],
    "projects": {
      "mode": "numeric-project-ids",
      "source": [
        "source_project_id"
      ],
      "target": [
        "target_project_id"
      ],
      "context": [
        "project_id"
      ]
    }
  },
  "checks": {
    "meaning": "head-pipeline",
    "primary": {
      "commands": [
        {
          "argv": [
            "api",
            {
              "parts": [
                "projects/",
                {
                  "slot": "project",
                  "encoding": "percent-component"
                },
                "/merge_requests/",
                {
                  "slot": "number",
                  "encoding": "literal"
                }
              ]
            },
            "--hostname",
            {
              "parts": [
                {
                  "slot": "host",
                  "encoding": "literal"
                }
              ]
            },
            "--method",
            "GET"
          ],
          "jsonExitCodes": [
            0
          ]
        }
      ],
      "result": {
        "guards": [
          {
            "path": [
              "sha"
            ],
            "binding": "headSha"
          },
          {
            "path": [
              "iid"
            ],
            "binding": "number"
          }
        ],
        "nullAt": [
          "head_pipeline"
        ],
        "rows": [
          "head_pipeline"
        ],
        "shape": "object",
        "limit": 1,
        "rowGuards": [
          {
            "path": [
              "sha"
            ],
            "binding": "headSha"
          }
        ],
        "variants": [
          {
            "value": [
              "status"
            ],
            "table": {
              "created": "pending",
              "waiting_for_resource": "pending",
              "preparing": "pending",
              "pending": "pending",
              "running": "pending",
              "manual": "pending",
              "scheduled": "pending",
              "success": "success",
              "failed": "failure",
              "canceled": "failure",
              "skipped": "none"
            }
          }
        ]
      }
    }
  }
}
